[
  {
    "name": "Club",
    "category": "simple melee weapon",
    "weight": 2,
    "cost": "1 SP",
    "description": "1d4 Bludgeoning. Properties: Light. Mastery: Slow."
  },
  {
    "name": "Dagger",
    "category": "simple melee weapon",
    "weight": 1,
    "cost": "2 GP",
    "description": "1d4 Piercing. Properties: Finesse, Light, Thrown (Range 20/60). Mastery: Nick."
  },
  {
    "name": "Greatclub",
    "category": "simple melee weapon",
    "weight": 10,
    "cost": "2 SP",
    "description": "1d8 Bludgeoning. Properties: Two-Handed. Mastery: Push."
  },
  {
    "name": "Handaxe",
    "category": "simple melee weapon",
    "weight": 2,
    "cost": "5 GP",
    "description": "1d6 Slashing. Properties: Light, Thrown (Range 20/60). Mastery: Vex."
  },
  {
    "name": "Javelin",
    "category": "simple melee weapon",
    "weight": 2,
    "cost": "5 SP",
    "description": "1d6 Piercing. Properties: Thrown (Range 30/120). Mastery: Slow."
  },
  {
    "name": "Light Hammer",
    "category": "simple melee weapon",
    "weight": 2,
    "cost": "2 GP",
    "description": "1d4 Bludgeoning. Properties: Light, Thrown (Range 20/60). Mastery: Nick."
  },
  {
    "name": "Mace",
    "category": "simple melee weapon",
    "weight": 4,
    "cost": "5 GP",
    "description": "1d6 Bludgeoning. Mastery: Sap."
  },
  {
    "name": "Quarterstaff",
    "category": "simple melee weapon",
    "weight": 4,
    "cost": "2 SP",
    "description": "1d6 Bludgeoning. Properties: Versatile (1d8). Mastery: Topple."
  },
  {
    "name": "Sickle",
    "category": "simple melee weapon",
    "weight": 2,
    "cost": "1 GP",
    "description": "1d4 Slashing. Properties: Light. Mastery: Nick."
  },
  {
    "name": "Spear",
    "category": "simple melee weapon",
    "weight": 3,
    "cost": "1 GP",
    "description": "1d6 Piercing. Properties: Thrown (Range 20/60), Versatile (1d8). Mastery: Sap."
  },
  {
    "name": "Dart",
    "category": "simple ranged weapon",
    "weight": 0.25,
    "cost": "5 CP",
    "description": "1d4 Piercing. Properties: Finesse, Thrown (Range 20/60). Mastery: Vex."
  },
  {
    "name": "Light Crossbow",
    "category": "simple ranged weapon",
    "weight": 5,
    "cost": "25 GP",
    "description": "1d8 Piercing. Properties: Ammunition (Range 80/320; Bolt), Loading, Two-Handed. Mastery: Slow."
  },
  {
    "name": "Shortbow",
    "category": "simple ranged weapon",
    "weight": 2,
    "cost": "25 GP",
    "description": "1d6 Piercing. Properties: Ammunition (Range 80/320; Arrow), Two-Handed. Mastery: Vex."
  },
  {
    "name": "Sling",
    "category": "simple ranged weapon",
    "weight": null,
    "cost": "1 SP",
    "description": "1d4 Bludgeoning. Properties: Ammunition (Range 30/120; Bullet). Mastery: Slow."
  },
  {
    "name": "Battleaxe",
    "category": "martial melee weapon",
    "weight": 4,
    "cost": "10 GP",
    "description": "1d8 Slashing. Properties: Versatile (1d10). Mastery: Topple."
  },
  {
    "name": "Flail",
    "category": "martial melee weapon",
    "weight": 2,
    "cost": "10 GP",
    "description": "1d8 Bludgeoning. Mastery: Sap."
  },
  {
    "name": "Glaive",
    "category": "martial melee weapon",
    "weight": 6,
    "cost": "20 GP",
    "description": "1d10 Slashing. Properties: Heavy, Reach, Two-Handed. Mastery: Graze."
  },
  {
    "name": "Greataxe",
    "category": "martial melee weapon",
    "weight": 7,
    "cost": "30 GP",
    "description": "1d12 Slashing. Properties: Heavy, Two-Handed. Mastery: Cleave."
  },
  {
    "name": "Greatsword",
    "category": "martial melee weapon",
    "weight": 6,
    "cost": "50 GP",
    "description": "2d6 Slashing. Properties: Heavy, Two-Handed. Mastery: Graze."
  },
  {
    "name": "Halberd",
    "category": "martial melee weapon",
    "weight": 6,
    "cost": "20 GP",
    "description": "1d10 Slashing. Properties: Heavy, Reach, Two-Handed. Mastery: Cleave."
  },
  {
    "name": "Lance",
    "category": "martial melee weapon",
    "weight": 6,
    "cost": "10 GP",
    "description": "1d10 Piercing. Properties: Heavy, Reach, Two-Handed (unless mounted). Mastery: Topple."
  },
  {
    "name": "Longsword",
    "category": "martial melee weapon",
    "weight": 3,
    "cost": "15 GP",
    "description": "1d8 Slashing. Properties: Versatile (1d10). Mastery: Sap."
  },
  {
    "name": "Maul",
    "category": "martial melee weapon",
    "weight": 10,
    "cost": "10 GP",
    "description": "2d6 Bludgeoning. Properties: Heavy, Two-Handed. Mastery: Topple."
  },
  {
    "name": "Morningstar",
    "category": "martial melee weapon",
    "weight": 4,
    "cost": "15 GP",
    "description": "1d8 Piercing. Mastery: Sap."
  },
  {
    "name": "Pike",
    "category": "martial melee weapon",
    "weight": 18,
    "cost": "5 GP",
    "description": "1d10 Piercing. Properties: Heavy, Reach, Two-Handed. Mastery: Push."
  },
  {
    "name": "Rapier",
    "category": "martial melee weapon",
    "weight": 2,
    "cost": "25 GP",
    "description": "1d8 Piercing. Properties: Finesse. Mastery: Vex."
  },
  {
    "name": "Scimitar",
    "category": "martial melee weapon",
    "weight": 3,
    "cost": "25 GP",
    "description": "1d6 Slashing. Properties: Finesse, Light. Mastery: Nick."
  },
  {
    "name": "Shortsword",
    "category": "martial melee weapon",
    "weight": 2,
    "cost": "10 GP",
    "description": "1d6 Piercing. Properties: Finesse, Light. Mastery: Vex."
  },
  {
    "name": "Trident",
    "category": "martial melee weapon",
    "weight": 4,
    "cost": "5 GP",
    "description": "1d8 Piercing. Properties: Thrown (Range 20/60), Versatile (1d10). Mastery: Topple."
  },
  {
    "name": "Warhammer",
    "category": "martial melee weapon",
    "weight": 5,
    "cost": "15 GP",
    "description": "1d8 Bludgeoning. Properties: Versatile (1d10). Mastery: Push."
  },
  {
    "name": "War Pick",
    "category": "martial melee weapon",
    "weight": 2,
    "cost": "5 GP",
    "description": "1d8 Piercing. Properties: Versatile (1d10). Mastery: Sap."
  },
  {
    "name": "Whip",
    "category": "martial melee weapon",
    "weight": 3,
    "cost": "2 GP",
    "description": "1d4 Slashing. Properties: Finesse, Reach. Mastery: Slow."
  },
  {
    "name": "Blowgun",
    "category": "martial ranged weapon",
    "weight": 1,
    "cost": "10 GP",
    "description": "1 Piercing. Properties: Ammunition (Range 25/100; Needle), Loading. Mastery: Vex."
  },
  {
    "name": "Hand Crossbow",
    "category": "martial ranged weapon",
    "weight": 3,
    "cost": "75 GP",
    "description": "1d6 Piercing. Properties: Ammunition (Range 30/120; Bolt), Light, Loading. Mastery: Vex."
  },
  {
    "name": "Heavy Crossbow",
    "category": "martial ranged weapon",
    "weight": 18,
    "cost": "50 GP",
    "description": "1d10 Piercing. Properties: Ammunition (Range 100/400; Bolt), Heavy, Loading, Two-Handed. Mastery: Push."
  },
  {
    "name": "Longbow",
    "category": "martial ranged weapon",
    "weight": 2,
    "cost": "50 GP",
    "description": "1d8 Piercing. Properties: Ammunition (Range 150/600; Arrow), Heavy, Two-Handed. Mastery: Slow."
  },
  {
    "name": "Musket",
    "category": "martial ranged weapon",
    "weight": 10,
    "cost": "500 GP",
    "description": "1d12 Piercing. Properties: Ammunition (Range 40/120; Bullet), Loading, Two-Handed. Mastery: Slow."
  },
  {
    "name": "Pistol",
    "category": "martial ranged weapon",
    "weight": 3,
    "cost": "250 GP",
    "description": "1d10 Piercing. Properties: Ammunition (Range 30/90; Bullet), Loading. Mastery: Vex."
  },
  {
    "name": "Padded Armor",
    "category": "light armor",
    "weight": 8,
    "cost": "5 GP",
    "description": "AC: 11 + Dex modifier. Stealth: Disadvantage."
  },
  {
    "name": "Leather Armor",
    "category": "light armor",
    "weight": 10,
    "cost": "10 GP",
    "description": "AC: 11 + Dex modifier."
  },
  {
    "name": "Studded Leather Armor",
    "category": "light armor",
    "weight": 13,
    "cost": "45 GP",
    "description": "AC: 12 + Dex modifier."
  },
  {
    "name": "Hide Armor",
    "category": "medium armor",
    "weight": 12,
    "cost": "10 GP",
    "description": "AC: 12 + Dex modifier (max 2)."
  },
  {
    "name": "Chain Shirt",
    "category": "medium armor",
    "weight": 20,
    "cost": "50 GP",
    "description": "AC: 13 + Dex modifier (max 2)."
  },
  {
    "name": "Scale Mail",
    "category": "medium armor",
    "weight": 45,
    "cost": "50 GP",
    "description": "AC: 14 + Dex modifier (max 2). Stealth: Disadvantage."
  },
  {
    "name": "Breastplate",
    "category": "medium armor",
    "weight": 20,
    "cost": "400 GP",
    "description": "AC: 14 + Dex modifier (max 2)."
  },
  {
    "name": "Half Plate Armor",
    "category": "medium armor",
    "weight": 40,
    "cost": "750 GP",
    "description": "AC: 15 + Dex modifier (max 2). Stealth: Disadvantage."
  },
  {
    "name": "Ring Mail",
    "category": "heavy armor",
    "weight": 40,
    "cost": "30 GP",
    "description": "AC: 14. Stealth: Disadvantage."
  },
  {
    "name": "Chain Mail",
    "category": "heavy armor",
    "weight": 55,
    "cost": "75 GP",
    "description": "AC: 16. Requires Str 13. Stealth: Disadvantage."
  },
  {
    "name": "Splint Armor",
    "category": "heavy armor",
    "weight": 60,
    "cost": "200 GP",
    "description": "AC: 17. Requires Str 15. Stealth: Disadvantage."
  },
  {
    "name": "Plate Armor",
    "category": "heavy armor",
    "weight": 65,
    "cost": "1,500 GP",
    "description": "AC: 18. Requires Str 15. Stealth: Disadvantage."
  },
  {
    "name": "Shield",
    "category": "shield",
    "weight": 6,
    "cost": "10 GP",
    "description": "AC: +2."
  },
  {
    "name": "Alchemist's Supplies",
    "category": "artisan's tool",
    "weight": 8,
    "cost": "50 GP",
    "description": "Ability: Intelligence. Utilize: Identify a substance (DC 15), or start a fire (DC 15). Craft: Acid, Alchemist's Fire, Component Pouch, Oil, Paper, Perfume."